Front,Back
"Minimum window substring: why can't you shrink the sliding window based on a fixed length threshold (e.g. len(t))?","Because the minimum valid window length isn't known in advance and can be longer than len(t). A length constant is a guess that fails on any input needing a longer window. Shrink must be conditioned on validity (while the window still contains all of t), in a loop, recording the best answer at each valid state before continuing to shrink."
"Minimum window substring: what's the concrete failure mode of checking 'sub_counter - windowCount' validity but shrinking unconditionally once length >= windowSize?","It evicts characters from the left before the window has had a chance to become valid with a longer span, so any valid answer longer than the fixed windowSize can never be found. Example: s='OUZODYXAZV', t='XYZ' -> correct answer 'YXAZ' (length 4) is missed because 'Y' gets shrunk out at length 3 before Z ever appears again."
"Sliding window validity check: why prefer a running have/needed counter over recomputing Counter(t) - Counter(window) every iteration?","The running counter is an O(1) incremental update (increment/decrement only when a specific character's count crosses its required threshold), versus an O(k) recomputation of the full diff every step. General pattern: maintain running state instead of recomputing from scratch."
"WordNet limitation (name it precisely): what's the concrete gap vs. embedding-based approaches, and does SentiWordNet fix it?","WordNet is human-curated (lags new/slang terms like 'bussin'), sparse for rare/domain-specific words, and represents similarity as discrete synonym-set membership rather than a continuous score. SentiWordNet does NOT fix this, it's a real extension that adds positive/negative/objective sentiment scores per synset, but it's still built on the same hand-curated synsets, so it inherits the staleness/curation problem. The actual fix for continuous similarity + automatic updating is word embeddings (word2vec, GloVe), learned from corpora."
"Meta-lesson: what's the two-part check when citing a named concept to support a claim?","Getting the name right isn't enough. Also confirm the named thing actually supports the specific claim being made about it, e.g. SentiWordNet is a real term, but citing it as 'the fix for WordNet's staleness' is wrong even though the name is correct."
"FastAPI: why does a Pydantic BaseModel as a parameter type matter for Request Body handling?","FastAPI parses the JSON request body against the model, validates every field, converts it into a fully-typed Python object, and automatically adds the model's shape to the OpenAPI schema so /docs shows the exact expected request body with no extra code."
"CS224N Lecture 1: what problem does distributional semantics / word embeddings solve relative to WordNet?","WordNet encodes discrete, human-curated synonym relationships that lag new usage and can't express degree of similarity. Distributional semantics (a word's meaning given by its context words) and learned dense vectors (word embeddings, e.g. Word2Vec) give continuous similarity (cosine distance) and are learned automatically from large corpora instead of hand-built."
