Front,Back
"Trapping Rain Water: how much water sits on column i, and is the answer a max or a sum?","water[i] = min(tallest wall to i's left, tallest wall to i's right) - height[i]. The total is the SUM over all columns (not a max over configurations - that's Container With Most Water). Each column is capped by the shorter of its two flanking maxes."
"Trapping Rain Water two-pointer: why is it safe to add leftMax - height[l] when leftMax < rightMax, without the exact right max?","Because leftMax < rightMax means the true right-side max for that column is also > leftMax, so min(leftMax, trueRightMax) = leftMax. The left wall is provably the shorter (limiting) wall, so leftMax is the correct cap. You move the shorter side; the taller side can only be taller, so it never changes the min."
"What does a Kubernetes rolling update actually do to the ReplicaSets?","The Deployment scales the NEW ReplicaSet UP gradually while scaling the OLD ReplicaSet DOWN gradually, a few pods at a time, keeping enough pods serving throughout (zero downtime). The old ReplicaSet is retained at 0 (not deleted) so rollout undo can scale it back - cheap rollback."
"In a Deployment YAML, what happens if selector.matchLabels does not match template.metadata.labels?","Kubernetes rejects the Deployment at apply time with a validation error ('selector does not match template labels'). The selector defines which pods the Deployment manages; if it can't match the pods it creates, it couldn't track them, so K8s refuses the config. (A Service with a selector matching nothing still applies - it just routes nowhere.)"
"You have 3 replicas and run kubectl delete pod on one. What happens and which component acts?","Desired is still 3 but only 2 exist, so the ReplicaSet controller (in kube-controller-manager) detects actual < desired and creates a replacement - the pod comes right back (self-healing). Note: pod-deletion-ordering (StatefulSet removes highest ordinal first) is a scale-DOWN concept, a different action where the pod is not replaced."
